{
 "schema_version": 1,
 "id": "00000000-0000-4000-8000-000000000002",
 "provenance": "sample",
 "created_at": "2026-10-12T12:00:00Z",
 "tool": {
  "name": "snapbench",
  "version": "0.1.0",
  "matrix_version": "2026.10"
 },
 "llama_cpp": {
  "tag": "b11700",
  "commit": "23f7aabc16c72f6f707dba227251c35d7bd1ed96",
  "sources": {
   "cpu": {
    "kind": "release",
    "bundle": "sample"
   },
   "opencl": {
    "kind": "release",
    "bundle": "sample"
   },
   "vulkan": {
    "kind": "release",
    "bundle": "sample"
   }
  }
 },
 "platform": {
  "os": "android",
  "os_version": "sample",
  "arch": "aarch64",
  "termux": true
 },
 "device": {
  "manufacturer": "SAMPLE",
  "model": "Sample phone A (Turnip)"
 },
 "soc": {
  "part": "SM8650",
  "name": "Snapdragon 8 Gen 3",
  "is_snapdragon": true
 },
 "cpu": {
  "name": null,
  "cores": 8
 },
 "gpu": {
  "name": "Adreno 750"
 },
 "memory_mb": 12000,
 "vulkaninfo": {
  "available": true,
  "error": null,
  "gpus": [
   {
    "index": 0,
    "device_name": "Turnip Adreno (TM) 750",
    "device_type": "PHYSICAL_DEVICE_TYPE_INTEGRATED_GPU",
    "driver_id": "DRIVER_ID_MESA_TURNIP",
    "driver_name": "turnip Mesa driver",
    "driver_info": "Mesa 25.3.0 (sample)",
    "driver_version": "25.3.0",
    "api_version": "1.4.318",
    "driver_kind": "turnip",
    "mesa_version": "25.3.0",
    "int_dot": {
     "shader_integer_dot_product": true,
     "int8_packed_signed_accelerated": false,
     "int8_packed_unsigned_accelerated": false,
     "int8_packed_mixed_accelerated": false
    },
    "cooperative_matrix": {
     "extension": false,
     "feature": null
    },
    "subgroup": {
     "size": 64,
     "min": 64,
     "max": 128,
     "size_control": true
    },
    "extensions": {
     "VK_KHR_shader_integer_dot_product": 1
    }
   }
  ]
 },
 "backends": {
  "cpu": {
   "status": "ok",
   "reason": null,
   "device": "none"
  },
  "opencl": {
   "status": "ok",
   "reason": null,
   "device": "GPUOpenCL"
  },
  "vulkan": {
   "status": "ok",
   "reason": null,
   "device": "Vulkan0"
  },
  "hexagon": {
   "status": "unavailable",
   "reason": "sample: backend not available"
  }
 },
 "config": {
  "n_prompt": 512,
  "n_gen": 128,
  "repetitions": 5,
  "threads": 6,
  "gpu_layers": 99,
  "cooldown_s": 20,
  "full_matrix": true,
  "env": {}
 },
 "runs": [
  {
   "backend": "cpu",
   "model": "llama-3.2-1b",
   "quant": "Q4_0",
   "model_file": "Llama-3.2-1B-Instruct-Q4_0.gguf",
   "model_sha256": "fa0390e7c043f89ae1847bd6682d748041a99d4ef3de0e0b27d33b6af97a8be8",
   "status": "ok",
   "error": null,
   "duration_s": 50.1,
   "before": {
    "max_temp_c": 36.4
   },
   "after": {
    "max_temp_c": 54.1
   },
   "tests": [
    {
     "test": "pp512",
     "avg_ts": 125.53,
     "stddev_ts": 2.51,
     "samples_ts": [
      127.78,
      123.31,
      123.45,
      127.22,
      126.72
     ]
    },
    {
     "test": "tg128",
     "avg_ts": 27.64,
     "stddev_ts": 0.55,
     "samples_ts": [
      27.43,
      27.76,
      27.76,
      27.73,
      27.26
     ]
    }
   ]
  },
  {
   "backend": "opencl",
   "model": "llama-3.2-1b",
   "quant": "Q4_0",
   "model_file": "Llama-3.2-1B-Instruct-Q4_0.gguf",
   "model_sha256": "fa0390e7c043f89ae1847bd6682d748041a99d4ef3de0e0b27d33b6af97a8be8",
   "status": "ok",
   "error": null,
   "duration_s": 59.2,
   "before": {
    "max_temp_c": 35.4
   },
   "after": {
    "max_temp_c": 44.3
   },
   "tests": [
    {
     "test": "pp512",
     "avg_ts": 99.44,
     "stddev_ts": 1.99,
     "samples_ts": [
      101.23,
      99.62,
      99.22,
      98.52,
      97.6
     ]
    },
    {
     "test": "tg128",
     "avg_ts": 14.94,
     "stddev_ts": 0.3,
     "samples_ts": [
      14.92,
      14.83,
      14.87,
      15.18,
      14.96
     ]
    }
   ]
  },
  {
   "backend": "vulkan",
   "model": "llama-3.2-1b",
   "quant": "Q4_0",
   "model_file": "Llama-3.2-1B-Instruct-Q4_0.gguf",
   "model_sha256": "fa0390e7c043f89ae1847bd6682d748041a99d4ef3de0e0b27d33b6af97a8be8",
   "status": "ok",
   "error": null,
   "duration_s": 44.8,
   "before": {
    "max_temp_c": 39.9
   },
   "after": {
    "max_temp_c": 57.5
   },
   "tests": [
    {
     "test": "pp512",
     "avg_ts": 43.9,
     "stddev_ts": 0.88,
     "samples_ts": [
      43.26,
      43.92,
      44.77,
      44.2,
      43.34
     ]
    },
    {
     "test": "tg128",
     "avg_ts": 10.55,
     "stddev_ts": 0.21,
     "samples_ts": [
      10.68,
      10.65,
      10.72,
      10.66,
      10.67
     ]
    }
   ]
  },
  {
   "backend": "cpu",
   "model": "llama-3.2-1b",
   "quant": "Q8_0",
   "model_file": "Llama-3.2-1B-Instruct-Q8_0.gguf",
   "model_sha256": "432f310a77f4650a88d0fd59ecdd7cebed8d684bafea53cbff0473542964f0c3",
   "status": "ok",
   "error": null,
   "duration_s": 52.3,
   "before": {
    "max_temp_c": 37.4
   },
   "after": {
    "max_temp_c": 56.9
   },
   "tests": [
    {
     "test": "pp512",
     "avg_ts": 112.4,
     "stddev_ts": 2.25,
     "samples_ts": [
      113.54,
      113.37,
      112.23,
      112.54,
      112.36
     ]
    },
    {
     "test": "tg128",
     "avg_ts": 17.74,
     "stddev_ts": 0.35,
     "samples_ts": [
      17.74,
      17.97,
      17.63,
      18.01,
      18.02
     ]
    }
   ]
  },
  {
   "backend": "opencl",
   "model": "llama-3.2-1b",
   "quant": "Q8_0",
   "model_file": "Llama-3.2-1B-Instruct-Q8_0.gguf",
   "model_sha256": "432f310a77f4650a88d0fd59ecdd7cebed8d684bafea53cbff0473542964f0c3",
   "status": "ok",
   "error": null,
   "duration_s": 55.3,
   "before": {
    "max_temp_c": 37.1
   },
   "after": {
    "max_temp_c": 53.1
   },
   "tests": [
    {
     "test": "pp512",
     "avg_ts": 95.91,
     "stddev_ts": 1.92,
     "samples_ts": [
      95.86,
      94.85,
      95.24,
      96.68,
      94.63
     ]
    },
    {
     "test": "tg128",
     "avg_ts": 10.49,
     "stddev_ts": 0.21,
     "samples_ts": [
      10.39,
      10.66,
      10.41,
      10.68,
      10.57
     ]
    }
   ]
  },
  {
   "backend": "vulkan",
   "model": "llama-3.2-1b",
   "quant": "Q8_0",
   "model_file": "Llama-3.2-1B-Instruct-Q8_0.gguf",
   "model_sha256": "432f310a77f4650a88d0fd59ecdd7cebed8d684bafea53cbff0473542964f0c3",
   "status": "ok",
   "error": null,
   "duration_s": 24.1,
   "before": {
    "max_temp_c": 37.9
   },
   "after": {
    "max_temp_c": 47.8
   },
   "tests": [
    {
     "test": "pp512",
     "avg_ts": 45.55,
     "stddev_ts": 0.91,
     "samples_ts": [
      45.21,
      45.02,
      45.58,
      46.35,
      45.78
     ]
    },
    {
     "test": "tg128",
     "avg_ts": 5.83,
     "stddev_ts": 0.12,
     "samples_ts": [
      5.91,
      5.88,
      5.93,
      5.76,
      5.89
     ]
    }
   ]
  },
  {
   "backend": "cpu",
   "model": "llama-3.2-3b",
   "quant": "Q4_0",
   "model_file": "Llama-3.2-3B-Instruct-Q4_0.gguf",
   "model_sha256": "4d491003bf6b470e4d04233824c5c939b76d6c81974ba17a3ff207343e1d8e85",
   "status": "ok",
   "error": null,
   "duration_s": 32.0,
   "before": {
    "max_temp_c": 38.0
   },
   "after": {
    "max_temp_c": 45.2
   },
   "tests": [
    {
     "test": "pp512",
     "avg_ts": 43.65,
     "stddev_ts": 0.87,
     "samples_ts": [
      44.3,
      42.96,
      43.69,
      44.27,
      43.2
     ]
    },
    {
     "test": "tg128",
     "avg_ts": 9.96,
     "stddev_ts": 0.2,
     "samples_ts": [
      10.12,
      9.93,
      10.05,
      9.78,
      9.91
     ]
    }
   ]
  },
  {
   "backend": "opencl",
   "model": "llama-3.2-3b",
   "quant": "Q4_0",
   "model_file": "Llama-3.2-3B-Instruct-Q4_0.gguf",
   "model_sha256": "4d491003bf6b470e4d04233824c5c939b76d6c81974ba17a3ff207343e1d8e85",
   "status": "ok",
   "error": null,
   "duration_s": 30.6,
   "before": {
    "max_temp_c": 34.2
   },
   "after": {
    "max_temp_c": 48.8
   },
   "tests": [
    {
     "test": "pp512",
     "avg_ts": 38.05,
     "stddev_ts": 0.76,
     "samples_ts": [
      37.32,
      38.39,
      37.32,
      37.67,
      38.52
     ]
    },
    {
     "test": "tg128",
     "avg_ts": 5.86,
     "stddev_ts": 0.12,
     "samples_ts": [
      5.78,
      5.9,
      5.83,
      5.75,
      5.97
     ]
    }
   ]
  },
  {
   "backend": "vulkan",
   "model": "llama-3.2-3b",
   "quant": "Q4_0",
   "model_file": "Llama-3.2-3B-Instruct-Q4_0.gguf",
   "model_sha256": "4d491003bf6b470e4d04233824c5c939b76d6c81974ba17a3ff207343e1d8e85",
   "status": "ok",
   "error": null,
   "duration_s": 53.1,
   "before": {
    "max_temp_c": 35.4
   },
   "after": {
    "max_temp_c": 53.3
   },
   "tests": [
    {
     "test": "pp512",
     "avg_ts": 17.59,
     "stddev_ts": 0.35,
     "samples_ts": [
      17.76,
      17.31,
      17.47,
      17.26,
      17.55
     ]
    },
    {
     "test": "tg128",
     "avg_ts": 3.99,
     "stddev_ts": 0.08,
     "samples_ts": [
      4.03,
      4.05,
      4.03,
      4.05,
      4.02
     ]
    }
   ]
  },
  {
   "backend": "cpu",
   "model": "llama-3.2-3b",
   "quant": "Q8_0",
   "model_file": "Llama-3.2-3B-Instruct-Q8_0.gguf",
   "model_sha256": "b5607b5090a8280063fff2d706bb3408ca6542341b06aab39c3eca0a28575921",
   "status": "ok",
   "error": null,
   "duration_s": 49.4,
   "before": {
    "max_temp_c": 34.1
   },
   "after": {
    "max_temp_c": 51.8
   },
   "tests": [
    {
     "test": "pp512",
     "avg_ts": 44.22,
     "stddev_ts": 0.88,
     "samples_ts": [
      43.51,
      44.13,
      44.88,
      43.56,
      44.37
     ]
    },
    {
     "test": "tg128",
     "avg_ts": 6.34,
     "stddev_ts": 0.13,
     "samples_ts": [
      6.35,
      6.25,
      6.46,
      6.28,
      6.37
     ]
    }
   ]
  },
  {
   "backend": "opencl",
   "model": "llama-3.2-3b",
   "quant": "Q8_0",
   "model_file": "Llama-3.2-3B-Instruct-Q8_0.gguf",
   "model_sha256": "b5607b5090a8280063fff2d706bb3408ca6542341b06aab39c3eca0a28575921",
   "status": "ok",
   "error": null,
   "duration_s": 37.6,
   "before": {
    "max_temp_c": 37.5
   },
   "after": {
    "max_temp_c": 52.7
   },
   "tests": [
    {